{
  "$schema": "https://json-schema.org/draft/2020-12/schema",
  "title": "ReviewResult",
  "description": "Contract for the `review` and `audit` --format json output (report.ReviewResult). The audit path reuses ReviewResult, so both commands share this schema.",
  "type": "object",
  "additionalProperties": false,
  "required": ["findings", "summary", "recommendation"],
  "properties": {
    "findings": {
      "description": "Findings ordered by severity. Encoded as null (not []) when there are none.",
      "type": ["array", "null"],
      "items": { "$ref": "#/$defs/finding" }
    },
    "summary": { "type": "string" },
    "recommendation": { "type": "string" },
    "gates": {
      "description": "Per-run counts for the hygiene stages of a review or an audit: the line anchor, the two demotion gates, and the changed-file check, which only a review runs. The anchor and the check never demote. The counts describe the whole run, not the filtered finding list. Absent when no stage ran, or on results produced before gate recording existed; an absent stage object means 'not recorded', not 'nothing demoted'.",
      "$ref": "#/$defs/gateStats"
    },
    "passes": {
      "description": "How each secondary pass the run requested ended (the adversarial pass, the coverage map, the feature-compliance check, each domain specialist), named by the session label usage.passes uses. Absent when the run requested none, and on results produced before pass recording existed. The primary review is never listed: its failure fails the run.",
      "type": "array",
      "items": { "$ref": "#/$defs/passStatus" }
    },
    "excluded_files": {
      "description": "Changed files the review's sessions were not pointed at, set only with --diff-exclusions: lock files, vendored directories (one entry per directory, with how many changed files under it were left out), and generated files. Absent when exclusions are off or no changed file matched.",
      "type": "array",
      "items": { "$ref": "#/$defs/excludedFile" }
    },
    "partitions": {
      "description": "The partitions of a partitioned review (--partition-files), in session order: each primary-review session's files, their added plus deleted lines (0 when git could not count them), and the findings that session returned before the merge. Absent when the review ran as one session.",
      "type": "array",
      "items": { "$ref": "#/$defs/reviewPartition" }
    }
  },
  "$defs": {
    "finding": {
      "type": "object",
      "additionalProperties": false,
      "required": ["id", "severity", "title", "file", "problem", "action"],
      "properties": {
        "id": { "type": "string" },
        "severity": {
          "type": "string",
          "enum": ["BLOCKING", "CRITICAL", "WARNING", "INFO"]
        },
        "title": { "type": "string" },
        "file": { "type": "string" },
        "line": { "type": "integer" },
        "line_end": { "type": "integer" },
        "pattern": { "type": "string" },
        "actionability": {
          "type": "string",
          "enum": ["auto-fix", "needs-discussion", "architectural"]
        },
        "fix_class": {
          "type": "string",
          "enum": ["AUTO-FIX", "ASK"]
        },
        "confidence": {
          "type": "string",
          "enum": ["verified", "likely", "uncertain"]
        },
        "problem": { "type": "string" },
        "action": { "type": "string" },
        "code_snippet": { "type": "string" },
        "suggested_fix": { "type": "string" },
        "fix_options": {
          "type": "array",
          "items": { "$ref": "#/$defs/fixOption" }
        },
        "recommended_option": { "type": "string" },
        "recommendation_reasoning": { "type": "string" },
        "related_to": {
          "type": "array",
          "items": { "type": "string" }
        },
        "confirmed_by": {
          "type": "array",
          "items": { "type": "string" }
        },
        "verification_note": { "type": "string" },
        "snippet_check": {
          "description": "The snippet gate's per-finding record: 'passed', a 'verified: <how>' string, or a 'demoted: <reason>' string. Set by the pipeline, never by the model.",
          "type": "string"
        },
        "claim_check": {
          "description": "The claim gate's per-finding record. Set by the pipeline, never by the model.",
          "type": "string",
          "enum": ["confirmed", "refuted", "no-verdict"]
        },
        "line_check": {
          "description": "The line anchor's per-finding record: 'anchored' kept the model's range, 'reanchored' moved it within the file, 'relocated' moved it to another changed file, 'unanchored' found no single place for the quote at the reviewed head. Set by the pipeline, never by the model.",
          "type": "string",
          "enum": ["anchored", "reanchored", "relocated", "unanchored"]
        }
      }
    },
    "gateStats": {
      "type": "object",
      "additionalProperties": false,
      "description": "Per-run counts for each hygiene stage, and the changed-file record. A missing stage object means the stage never ran this run; a missing files object means the review prompt listed no changed files.",
      "properties": {
        "anchor": { "$ref": "#/$defs/anchorGateStats" },
        "snippet": { "$ref": "#/$defs/snippetGateStats" },
        "claim": { "$ref": "#/$defs/claimGateStats" },
        "files": { "$ref": "#/$defs/fileGateStats" }
      }
    },
    "anchorGateStats": {
      "type": "object",
      "additionalProperties": false,
      "description": "The line anchor's counts, taken over each pass's findings before the merge, so a defect that several passes report counts once per pass. The findings confirmed on the model's range ('anchored') are examined minus the other three.",
      "required": ["examined", "reanchored", "unanchored"],
      "properties": {
        "examined": {
          "description": "Findings that carry a file and a non-blank quote.",
          "type": "integer"
        },
        "reanchored": {
          "description": "Findings moved to the quoted code in the same file.",
          "type": "integer"
        },
        "relocated": {
          "description": "Findings moved to the one other changed file that holds the quote. Absent when zero.",
          "type": "integer"
        },
        "unanchored": {
          "description": "Findings whose quote pins no single place in the head content; they keep the model's line.",
          "type": "integer"
        }
      }
    },
    "snippetGateStats": {
      "type": "object",
      "additionalProperties": false,
      "required": ["examined", "demoted"],
      "properties": {
        "examined": { "type": "integer" },
        "demoted": { "type": "integer" },
        "recovered_outside_diff": {
          "description": "Findings whose quoted code was absent from the changed files but found elsewhere in the checkout, and so were kept. Absent when zero, and never set by an audit.",
          "type": "integer"
        }
      }
    },
    "claimGateStats": {
      "type": "object",
      "additionalProperties": false,
      "required": ["sent", "verdicts", "refuted"],
      "properties": {
        "sent": { "type": "integer" },
        "verdicts": { "type": "integer" },
        "refuted": { "type": "integer" }
      }
    },
    "fileGateStats": {
      "type": "object",
      "additionalProperties": false,
      "description": "The changed-file check: the review session's own account of the files its prompt listed, compared with that list. It never moves a finding.",
      "required": ["changed", "reviewed"],
      "properties": {
        "changed": {
          "description": "The files the review prompt listed: the changed files minus the excluded files and the .planwerk/ planning artifacts.",
          "type": "integer"
        },
        "reviewed": {
          "description": "The listed files the session reported reading.",
          "type": "integer"
        },
        "missing": {
          "description": "Every other listed file, in listed order. Absent when the session reported reading every one.",
          "type": "array",
          "items": { "$ref": "#/$defs/missingFile" }
        }
      }
    },
    "missingFile": {
      "type": "object",
      "additionalProperties": false,
      "required": ["file", "status"],
      "properties": {
        "file": { "type": "string" },
        "status": {
          "description": "skipped: the session said it did not read the file, with its reason. unreported: its account left the file out.",
          "type": "string",
          "enum": ["skipped", "unreported"]
        },
        "reason": { "type": "string" }
      }
    },
    "passStatus": {
      "type": "object",
      "additionalProperties": false,
      "required": ["pass", "status"],
      "properties": {
        "pass": { "type": "string" },
        "status": {
          "type": "string",
          "enum": ["ran", "gated-out", "failed"]
        },
        "error": {
          "description": "Set for a failed pass only: the first line of its error, secrets redacted, at most 200 bytes.",
          "type": "string"
        }
      }
    },
    "excludedFile": {
      "type": "object",
      "additionalProperties": false,
      "required": ["path", "reason"],
      "properties": {
        "path": {
          "description": "Repository-relative path; a vendored directory ends in '/'.",
          "type": "string"
        },
        "reason": {
          "type": "string",
          "enum": ["lockfile", "vendored", "generated"]
        },
        "files": {
          "description": "Set for a vendored directory only: how many of its changed files were left out.",
          "type": "integer",
          "minimum": 1
        }
      }
    },
    "reviewPartition": {
      "type": "object",
      "additionalProperties": false,
      "required": ["files", "lines", "findings"],
      "properties": {
        "files": {
          "description": "The changed files this partition's review session reviewed.",
          "type": "array",
          "items": { "type": "string" }
        },
        "lines": {
          "description": "The added plus deleted lines of those files; a binary file counts 0.",
          "type": "integer"
        },
        "findings": {
          "description": "The findings the session returned, before the merge, the gates and the filters.",
          "type": "integer"
        }
      }
    },
    "fixOption": {
      "type": "object",
      "additionalProperties": false,
      "required": ["id", "approach"],
      "properties": {
        "id": { "type": "string" },
        "approach": { "type": "string" },
        "pros": { "type": "string" },
        "cons": { "type": "string" },
        "effort": { "type": "string" },
        "risk_if_skipped": { "type": "string" }
      }
    }
  }
}
